### ISSUE TITLE
Can't use with hetzner storagebox

### ISSUE THREAD

**Issue by catap** [rustic-rs/rustic#1487]
Profile:

```
[repository]
password = "XXXX"
repository = "opendal:sftp"

[repository.options]
endpoint = "ssh://XXXX.your-storagebox.de:23"
user = "XXXX"
key = "/root/.ssh/id_ed25519"
root = "/kirill-daily-driver.backup"
```

trace-log in console:
```
[INFO] using config /etc/rustic/rustic.toml
[DEBUG] (1) opendal::services::sftp::backend: sftp backend build started: SftpBuilder { config: SftpConfig { endpoint: Some("ssh://XXXX.your-storagebox.de:23"), root: Some("/kirill-daily-driver.backup"), .. } }
[DEBUG] (1) opendal::services::sftp::backend: sftp backend finished: SftpBuilder { config: SftpConfig { endpoint: Some("ssh://XXXX.your-storagebox.de:23"), root: Some("/kirill-daily-driver.backup"), .. } }
[TRACE] (1) mio::poll: [/usr/obj/ports/rustic-0.9.5/rustic-0.9.5/modcargo-crates/mio-1.0.3/src/poll.rs:571] registering event source with poller: token=Token(1), interests=READABLE
[DEBUG] (1) opendal::services: service=sftp name= : metadata started
[DEBUG] (1) opendal::services: service=sftp name= : metadata finished
[DEBUG] (1) opendal::services: service=sftp name= : metadata started
[DEBUG] (1) opendal::services: service=sftp name= : metadata finished
[DEBUG] (1) opendal::services: service=sftp name= : metadata started
[DEBUG] (1) opendal::services: service=sftp name= : metadata finished
[DEBUG] (1) opendal::services: service=sftp name= : metadata started
[DEBUG] (1) opendal::services: service=sftp name= : metadata finished
[TRACE] (1) rustic_backend::opendal: [/usr/obj/ports/rustic-0.9.5/rustic-0.9.5/modcargo-crates/rustic_backend-0.5.2/src/opendal.rs:222] listing tpe: Config
[DEBUG] (1) opendal::services: service=sftp name= path=config: stat started
[WARN] will retry after 1.524551749s because: Unexpected (temporary) at stat, context: { service: sftp, path: config } => connection request: timeout
[WARN] will retry after 2.927398086s because: Unexpected (temporary) at stat, context: { service: sftp, path: config } => connection request: timeout
^C[INFO] Ctrl-C received, shutting down...

```

traffic:
```
00:52:53.537811 a.b.c.d.23 > 172.31.2.77.7809: S 1779098451:1779098451(0) ack 2081197286 win 65160 <mss 1460,sackOK,timestamp 997571650 4176094970,nop,wscale 7> (DF)
00:52:53.537923 172.31.2.77.7809 > a.b.c.d.23: . ack 1 win 256 <nop,nop,timestamp 4176095010 997571650> (DF) [tos 0x48]
00:52:53.539397 172.31.2.77.7809 > a.b.c.d.23: P 1:23(22) ack 1 win 256 <nop,nop,timestamp 4176095010 997571650> (DF) [tos 0x48]
00:52:53.577366 a.b.c.d.23 > 172.31.2.77.7809: . ack 23 win 509 <nop,nop,timestamp 997571688 4176095010> (DF)
00:52:53.577369 a.b.c.d.23 > 172.31.2.77.7809: P 1:44(43) ack 23 win 509 <nop,nop,timestamp 997571692 4176095010> (DF)
00:52:53.579632 172.31.2.77.7809 > a.b.c.d.23: . 23:1471(1448) ack 44 win 256 <nop,nop,timestamp 4176095050 997571692> (DF) [tos 0x48]
00:52:53.579645 172.31.2.77.7809 > a.b.c.d.23: P 1471:1591(120) ack 44 win 256 <nop,nop,timestamp 4176095050 997571692> (DF) [tos 0x48]
00:52:53.626406 a.b.c.d.23 > 172.31.2.77.7809: P 44:620(576) ack 1471 win 524 <nop,nop,timestamp 997571732 4176095050> (DF)
00:52:53.658406 a.b.c.d.23 > 172.31.2.77.7809: . ack 1591 win 524 <nop,nop,timestamp 997571777 4176095050> (DF)
00:52:53.658530 172.31.2.77.7809 > a.b.c.d.23: P 1591:1639(48) ack 620 win 256 <nop,nop,timestamp 4176095130 997571732> (DF) [tos 0x48]
00:52:53.687351 a.b.c.d.23 > 172.31.2.77.7809: . ack 1639 win 524 <nop,nop,timestamp 997571801 4176095130> (DF)
00:52:53.687354 a.b.c.d.23 > 172.31.2.77.7809: P 620:1120(500) ack 1639 win 524 <nop,nop,timestamp 997571805 4176095130> (DF)
00:52:53.689829 172.31.2.77.7809 > a.b.c.d.23: F 1639:1639(0) ack 1120 win 256 <nop,nop,timestamp 4176095160 997571805> (DF) [tos 0x48]
00:52:53.727342 a.b.c.d.23 > 172.31.2.77.7809: F 1120:1120(0) ack 1640 win 524 <nop,nop,timestamp 997571843 4176095160> (DF)
00:52:53.727452 172.31.2.77.7809 > a.b.c.d.23: . ack 1121 win 256 <nop,nop,timestamp 4176095190 997571843> (DF) [tos 0x48]
00:52:56.932997 172.31.2.77.1240 > a.b.c.d.23: S 709153299:709153299(0) win 16384 <mss 1460,nop,nop,sackOK,nop,wscale 6,nop,nop,timestamp 3391503890 0> (DF) [tos 0x48]
00:52:56.967753 a.b.c.d.23 > 172.31.2.77.1240: S 29699788:29699788(0) ack 709153300 win 65160 <mss 1460,sackOK,timestamp 997575084 3391503890,nop,wscale 7> (DF)
00:52:56.967867 172.31.2.77.1240 > a.b.c.d.23: . ack 1 win 256 <nop,nop,timestamp 3391503930 997575084> (DF) [tos 0x48]
00:52:56.969325 172.31.2.77.1240 > a.b.c.d.23: P 1:23(22) ack 1 win 256 <nop,nop,timestamp 3391503930 997575084> (DF) [tos 0x48]
00:52:57.001373 a.b.c.d.23 > 172.31.2.77.1240: . ack 23 win 509 <nop,nop,timestamp 997575119 3391503930> (DF)
00:52:57.007272 a.b.c.d.23 > 172.31.2.77.1240: P 1:44(43) ack 23 win 509 <nop,nop,timestamp 997575123 3391503930> (DF)
00:52:57.009189 172.31.2.77.1240 > a.b.c.d.23: . 23:1471(1448) ack 44 win 256 <nop,nop,timestamp 3391503970 997575123> (DF) [tos 0x48]
00:52:57.009202 172.31.2.77.1240 > a.b.c.d.23: P 1471:1591(120) ack 44 win 256 <nop,nop,timestamp 3391503970 997575123> (DF) [tos 0x48]
00:52:57.037744 a.b.c.d.23 > 172.31.2.77.1240: P 44:620(576) ack 1471 win 524 <nop,nop,timestamp 997575155 3391503970> (DF)
00:52:57.078425 a.b.c.d.23 > 172.31.2.77.1240: . ack 1591 win 524 <nop,nop,timestamp 997575196 3391503970> (DF)
00:52:57.078523 172.31.2.77.1240 > a.b.c.d.23: P 1591:1639(48) ack 620 win 256 <nop,nop,timestamp 3391504040 997575155> (DF) [tos 0x48]
00:52:57.107295 a.b.c.d.23 > 172.31.2.77.1240: . ack 1639 win 524 <nop,nop,timestamp 997575224 3391504040> (DF)
00:52:57.109907 a.b.c.d.23 > 172.31.2.77.1240: P 620:1120(500) ack 1639 win 524 <nop,nop,timestamp 997575228 3391504040> (DF)
00:52:57.112020 172.31.2.77.1240 > a.b.c.d.23: F 1639:1639(0) ack 1120 win 256 <nop,nop,timestamp 3391504070 997575228> (DF) [tos 0x48]
00:52:57.144300 a.b.c.d.23 > 172.31.2.77.1240: F 1120:1120(0) ack 1640 win 524 <nop,nop,timestamp 997575262 3391504070> (DF)
00:52:57.144408 172.31.2.77.1240 > a.b.c.d.23: . ack 1121 win 256 <nop,nop,timestamp 3391504100 997575262> (DF) [tos 0x48]
^C
```
as you may see rustic closes conenction, but reports timeout.

**Comment by catap** [comment]
Using `22` port passes that, but fails as:
```
[ERROR] error backing up /: `rustic_core` experienced an error related to `the backend`.

Message:
Writing file `data/93/936daf6ef88deb8abf0e57332890e6d17cdc36f05ad199cc0af68c00174d72ee` failed in the backend. Please check if the given path is correct.


Some additional details ...

Context:
- type: Pack
- id: 936daf6e

Caused by:
NotFound (persistent) at write, context: { service: sftp, path: data/93/936daf6ef88deb8abf0e57332890e6d17cdc36f05ad199cc0af68c00174d72ee } => sftp error, source: Sftp server reported error kind NoSuchFile, msg: Err Message: No such file, Language Tag: en-US
 : (source: Sftp server reported error kind NoSuchFile, msg: Err Message: No such file, Language Tag: en-US)

Backtrace:
disabled backtrace (set 'RUST_BACKTRACE="1"' environment variable to enable)
```

**Comment by hamlet42** [comment]
My storage box works without problems with rustic. Port 23 needs to be used. One difference I see in your config compared to mine: The path needs always to be started with "/home/" so in your case that would need to be root = "**/home**/kirill-daily-driver.backup".

That "/home" is required for the main user and also for a subuser if you have created that. I

**Comment by catap** [comment]
@hamlet42 thanks for suggestion. Just tried it, nothing had changed. I run it as:
```
/usr/local/bin/rustic \
	--use-profile rustic \
	--cache-dir /var/cache/rustic \
	--log-level trace \
	backup \
	--no-scan \
	--glob-file /etc/rustic/rustic.files \
	/etc \
	/root \
	/home/catap \
	/var/backups \
	/var/cron/tabs \
	/usr/ports \
	/usr/src \
	/usr/xenocara
```

**Comment by hamlet42** [comment]
Aah, another config difference. my endpoint is endpoint = "ssh://XXXX-subY@XXXX.your-storagebox.de:23". As you can see, I am using a sub-user. If you do not, you need to remove the "-subY"

**Comment by catap** [comment]
@hamlet42 no, I don't and I haven't got any sub-user. Anyway, restic with almost identical setup works from the same machine.

**Comment by aawsome** [comment]
@catap see https://github.com/rustic-rs/rustic/blob/main/config/services/sftp_hetzner_sbox.toml. We have many users who reported that this config (replace the xxx, etc) works for them.

**Comment by catap** [comment]
@aawsome is it possible to dump commands which is executed? Or somehow increase verbose loging.

**Comment by aawsome** [comment]
@catap There is no command executed, AFAIK. This is a difference to how restic uses ssh. And also ssh only works with key authentication. An alternative would be to use the rclone backend.

For logging use `--log-level`, but I just saw, you already used this.

**Comment by catap** [comment]
@aawsome I run it as `--log-level trace` and have almost nothing.

How can I dig it future?

**Comment by enboig** [comment]
I was having some problems, as  and ended configuring the host in ~/.ssh/config:
```
host hetzner_rustic
  HostName uXXXXX.your-storagebox.de
  User uXXXXX-sub3
  IdentityFile ~/.ssh/id_ed25519_rustic
  Port 23
```

The ony difference in respository.options is:
```
[repository.options]
endpoint = "ssh://hetzner_rustic"
....
connections = "4"
```

Can you SSH the box?
```
# ssh hetzner_rustic
+------------------------------------------------------------------+
| Welcome to your Storage Box.                                     |
|                                                                  |
| Please note that this is only a restricted shell environment and |
| therefore some shell features like pipes and redirects are not   |
| supported.                                                       |
+------------------------------------------------------------------+
uXXXXX-sub3 /home >
```

**Comment by catap** [comment]
@enboig thanks for advice. I had put to end of `/etc/ssh/ssh_config`:

```
Host rusticbox
  HostName XXX.your-storagebox.de
  User XXX
  Port 23
  IdentityFile /root/.ssh/id_ed25519
```

and use following `.toml` profile:
```
[repository]
password = "XXX"
repository = "opendal:sftp"

[repository.options]
endpoint = "ssh://rusticbox"
root = "/home/kirill-daily-driver.backup"
```

and it fails with the same way.

But after some future digging with [kdump](https://man.openbsd.org/kdump) I was adble to locate the issue.

I use smartcard as `ssh-agent` via `gpg` and have enirinment variable `SSH_AUTH_SOCK` with value `/home/catap/.gnupg/S.gpg-agent.ssh`.

So after `unset SSH_AUTH_SOCK`... it works. With both way `endpoint = "ssh://rusticbox"` and `endpoint = "ssh://XXXX.your-storagebox.de:23"`, but it needs `root = "/home/kirill-daily-driver.backup"`
